{
  "version": "001.000.000",
  "mode": "single",
  "created": "2025-03-08T14:23:00Z",
  "updated": "2025-03-08T14:23:00Z",
  
  "profile": {
    "name": "Matti Example",
    "pubkey": "61050fdd097640415c9a65e85174a7a7a9bf4394d51e53e35f564264e08fcddf",
    "avatar": "ipfs://QmAvatar123",
    "bio": "Decentralized social media advocate",
    "website": "https://matt.example"
  },
  
  "protocols": {
    "priority": ["ipfs", "https"],
    "ipfs": {
      "url": "ipfs://QmProfile123"
    },
    "https": {
      "url": "https://matt.example/filu-x.json"
    }
  },
  
  "privacy_policy": "public-only",
  
  "posts": [
    {
      "id": "0000001.a1b2c3d4e5f6",
      "created": "2025-03-08T14:23:00Z",
      "text": "Hello world! This is my first Filu-X post.",
      "media": [
        {
          "type": "image",
          "urls": {
            "ipfs": "ipfs://QmImage123"
          },
          "alt": "Filu-X logo"
        }
      ]
    },
    {
      "id": "0000002.b2c3d4e5f6a7",
      "created": "2025-03-07T09:12:00Z",
      "text": "Another post in the same file."
    }
  ],
  
  "statistics": {
    "total_posts": 2,
    "last_sequence": 2
  },
  
  "signature": {
    "pubkey": "61050fdd097640415c9a65e85174a7a7a9bf4394d51e53e35f564264e08fcddf",
    "value": "MEUCIQDpY7RvHcTz2hZJkLqX8xKJyKJyKJyKJyKJyKJyKJyKJyKQIgQEiI",
    "algorithm": "ed25519"
  }
}
